date,username,to,replies,retweets,favorites,text,geo,mentions,hashtags,id,permalink
2020-03-18 13:37:46,realDonaldTrump,,10838,30138,142561,"We will be, by mutual consent, temporarily closing our Northern Border with Canada to non-essential traffic. Trade will not be affected. Details to follow!",,,,1240271178692005889,https://twitter.com/realDonaldTrump/status/1240271178692005889
2020-03-18 13:30:02,realDonaldTrump,,6799,8813,43328,"....Also, according to the Daily Caller, leading Sleepy Joe Biden in Florida, 48% to 42%.",,,,1240269231410774016,https://twitter.com/realDonaldTrump/status/1240269231410774016
2020-03-18 13:29:58,realDonaldTrump,,29307,23740,122171,"95% Approval Rating in the Republican Party, 53% overall. Not bad considering I get nothing but Fake & Corrupt News, day and night. “Russia, Russia, Russia”, then “the Ukraine Scam (where’s the Whistleblower?)”, the “Impeachment Hoax”, and more, more, more....",,,,1240269212871995393,https://twitter.com/realDonaldTrump/status/1240269212871995393
2020-03-18 13:16:07,realDonaldTrump,,10677,18803,83154,"The DNC will have gotten their fondest wish and defeated Bernie Sanders, far ahead of schedule. Now they are doing everything possible to be nice to him in order to keep his supporters. Bernie has given up, just like he did last time. He will be dropping out soon! MAGA/KAG",,,,1240265729108303873,https://twitter.com/realDonaldTrump/status/1240265729108303873
2020-03-18 11:46:33,realDonaldTrump,,104694,59728,304301,"I always treated the Chinese Virus very seriously, and have done a very good job from the beginning, including my very early decision to close the “borders” from China - against the wishes of almost all. Many lives were saved. The Fake News new narrative is disgraceful & false!",,,,1240243188708839424,https://twitter.com/realDonaldTrump/status/1240243188708839424
2020-03-18 11:12:49,realDonaldTrump,,29505,34312,165027,"I will be having a news conference today to discuss very important news from the FDA concerning the Chinese Virus!",,,,1240234698053431305,https://twitter.com/realDonaldTrump/status/1240234698053431305
2020-03-18 10:53:58,realDonaldTrump,,16935,27349,161139,"I will totally protect your Medicare & Social Security!",,,,1240229954044002304,https://twitter.com/realDonaldTrump/status/1240229954044002304
2020-03-18 10:41:14,realDonaldTrump,,30374,45186,218127,"For the people that are now out of work because of the important and necessary containment policies, for instance the shutting down of hotels, bars and restaurants, money will soon be coming to you. The onslaught of the Chinese Virus is not your fault! Will be stronger than ever!",,,,1240226752447873027,https://twitter.com/realDonaldTrump/status/1240226752447873027
2020-03-17 20:12:55,realDonaldTrump,,5858,12932,52187,"",,,,1240008233781248002,https://twitter.com/realDonaldTrump/status/1240008233781248002
2020-03-17 19:31:33,realDonaldTrump,,67398,109356,555068,"The world is at war with a hidden enemy. WE WILL WIN!",,,,1239997820242923521,https://twitter.com/realDonaldTrump/status/1239997820242923521
2020-03-17 13:34:01,realDonaldTrump,,16007,20418,103794,"Federal Government is working very well with the Governors and State officials. Good things will happen! #KILLTHEVIRUS",,,#KILLTHEVIRUS,1239907845719691265,https://twitter.com/realDonaldTrump/status/1239907845719691265
2020-03-17 13:27:18,realDonaldTrump,,32185,19092,101262,"Failing Michigan Governor must work harder and be much more proactive. We are pushing her to get the job done. I stand with Michigan!",,,,1239906156463652868,https://twitter.com/realDonaldTrump/status/1239906156463652868
2020-03-17 12:22:11,realDonaldTrump,,51557,37803,177271,"Cuomo wants “all states to be treated the same.” But all states aren’t the same. Some are being hit hard by the Chinese Virus, some are being hit practically not at all. New York is a very big “hotspot”, West Virginia has, thus far, zero cases. Andrew, keep politics out of it....",,,,1239889767267008512,https://twitter.com/realDonaldTrump/status/1239889767267008512
2020-03-17 03:27:51,realDonaldTrump,MattWolking,12981,21968,86311,"The “Times” is a disgrace to journalism!",,,,1239755298811908096,https://twitter.com/realDonaldTrump/status/1239755298811908096
2020-03-17 03:19:49,realDonaldTrump,LindseyGrahamSC,2918,8940,60143,"Great news Lindsey!",,,,1239753277358686209,https://twitter.com/realDonaldTrump/status/1239753277358686209
2020-03-16 22:51:54,realDonaldTrump,,127591,69978,320569,"The United States will be powerfully supporting those industries, like Airlines and others, that are particularly affected by the Chinese Virus. We will be stronger than ever before!",,,,1239685852093169664,https://twitter.com/realDonaldTrump/status/1239685852093169664
2020-03-16 20:29:46,realDonaldTrump,,22582,51150,243547,"I ask all Americans to band together and support your neighbors by not hoarding unnecessary amounts of food and essentials. TOGETHER we will stay STRONG and overcome this challenge!",,,,1239650086491230209,https://twitter.com/realDonaldTrump/status/1239650086491230209
2020-03-16 20:29:30,realDonaldTrump,,6999,24902,118091,"Yesterday I spoke with the great American Grocers and Supply Chain Executives. We are confident that supply will continue to meet demand nationwide. These beacons of our community will remain open for you, no matter what. We are working hard to remove any barriers to that effort!",,,,1239650018832891905,https://twitter.com/realDonaldTrump/status/1239650018832891905
2020-03-16 20:16:34,realDonaldTrump,,5638,21255,65640,"",,,,1239646763222474754,https://twitter.com/realDonaldTrump/status/1239646763222474754
2020-03-16 20:16:23,realDonaldTrump,,3381,16372,51298,"",,,,1239646718624436237,https://twitter.com/realDonaldTrump/status/1239646718624436237
2020-03-16 18:32:44,realDonaldTrump,,23798,16665,96496,"Just had a very good tele-conference with Nation’s Governors. Went very well. Cuomo of New York has to “do more”.",,,,1239620630523322368,https://twitter.com/realDonaldTrump/status/1239620630523322368
2020-03-16 15:00:41,realDonaldTrump,,30601,34494,199389,"Everybody is so well unified and working so hard. It is a beautiful thing to see. They love our great Country. We will end up being stronger than ever before!",,,,1239567267312152576,https://twitter.com/realDonaldTrump/status/1239567267312152576
2020-03-16 12:41:22,realDonaldTrump,,45011,67527,426154,"God Bless the USA!",,,,1239532209427623936,https://twitter.com/realDonaldTrump/status/1239532209427623936
2020-03-16 03:34:33,realDonaldTrump,,9834,27036,92417,"",,,,1239394598667071488,https://twitter.com/realDonaldTrump/status/1239394598667071488
2020-03-16 02:51:02,realDonaldTrump,,28687,38976,182563,"I must say, that was a VERY boring debate. Biden lied when he said I want to cut Social Security and Medicare. That’s what they ALL said 4 years ago, and nothing happened, in fact, I saved Social Security and Medicare. I will not be cutting, but they will. Be careful!",,,,1239383648018804739,https://twitter.com/realDonaldTrump/status/1239383648018804739
2020-03-15 22:53:05,realDonaldTrump,,22142,18929,88618,"The individual Governors of States, and local officials, must step up their efforts on drive up testing and testing sights, working in conjunction with @CDCgov and the Federal Government!",,@CDCgov,,1239323762987851778,https://twitter.com/realDonaldTrump/status/1239323762987851778
2020-03-15 18:08:35,realDonaldTrump,Google_Comms,17888,29647,101831,"The Fake and Corrupt News never called Google. They said this was not true. Even in times such as these, they are not truthful. Watch for their apology, it won’t happen. More importantly, thank you to Google!",,,,1239252169150410752,https://twitter.com/realDonaldTrump/status/1239252169150410752
2020-03-15 17:29:03,realDonaldTrump,,57455,62054,232027,"So now it is reported that, after destroying his life & the life of his wonderful family (and many others also), the FBI, working in conjunction with the Justice Department, has “lost” the records of General Michael Flynn. How convenient. I am strongly considering a Full Pardon!",,,,1239242219019735042,https://twitter.com/realDonaldTrump/status/1239242219019735042
2020-03-15 17:09:50,realDonaldTrump,,23935,29688,122026,"Can’t believe they are not going after Schumer for the threats he made to our cherished United States Supreme Court, and our two great Justices. If a Republican did that, there would be an endless price to pay. Pathetic!",,,,1239237382458806277,https://twitter.com/realDonaldTrump/status/1239237382458806277
2020-03-15 17:02:00,realDonaldTrump,,21648,13137,51967,"....The USA was never set up for this, just look at the catastrophe of the H1N1 Swine Flu (Biden in charge, 17,000 people lost, very late response time), but it soon will be. Great decision to close our China, and other, borders early. Saved many lives!",,,,1239235411463020544,https://twitter.com/realDonaldTrump/status/1239235411463020544
2020-03-15 17:02:00,realDonaldTrump,,7084,16745,71733,"There will be a News Conference by the CoronaVirus Task Force today at the White House, 5 P.M. @VP We are working closely with the Governors of our Country’s great States, which are a very big factor. They are working hard, along with us, to get the job properly done.....",,@VP,,1239235409491767298,https://twitter.com/realDonaldTrump/status/1239235409491767298
2020-03-15 16:34:23,realDonaldTrump,,18235,25733,135524,"We are doing very precise Medical Screenings at our airports. Pardon the interruptions and delays, we are moving as quickly as possible, but it is very important that we be vigilant and careful. We must get it right. Safety first!",,,,1239228460863819778,https://twitter.com/realDonaldTrump/status/1239228460863819778
2020-03-15 15:20:33,realDonaldTrump,,9080,13004,80899,"I am watching a great and beautiful service by Pastor Jentezen Franklin. Thank you! @Jentezen",,@Jentezen,,1239209878469644288,https://twitter.com/realDonaldTrump/status/1239209878469644288
2020-03-15 15:02:16,realDonaldTrump,,34602,73375,401216,"TODAY IS A NATIONAL DAY OF PRAYER. GOD BLESS EVERYONE!",,,,1239205277381132290,https://twitter.com/realDonaldTrump/status/1239205277381132290
2020-03-15 14:58:31,realDonaldTrump,JudicialWatch,10941,20258,65955,"Great Job by Judicial Watch. Potentially a treasure trove. Too bad you are not given more help, but it will all work out!",,,,1239204333851488266,https://twitter.com/realDonaldTrump/status/1239204333851488266
2020-03-15 14:49:20,realDonaldTrump,Scavino45,4715,10791,45689,"This took place in the Rose Garden, just coming out of a cold Winter!",,,,1239202025029734400,https://twitter.com/realDonaldTrump/status/1239202025029734400
2020-03-15 14:45:29,realDonaldTrump,Scavino45,6563,19568,73107,"Amazing how the Fake News never covers this. No Interest on Student Loans. The Dems are just talk!",,,,1239201055315025920,https://twitter.com/realDonaldTrump/status/1239201055315025920
2020-03-15 14:42:54,realDonaldTrump,SaraCarterDC,2213,8635,41356,"Thank you Sara. Keep writing, great talent!",,,,1239200405587976193,https://twitter.com/realDonaldTrump/status/1239200405587976193
2020-03-15 14:35:37,realDonaldTrump,kayleighmcenany,3890,9911,46736,"Thank you!",,,,1239198573016817665,https://twitter.com/realDonaldTrump/status/1239198573016817665
2020-03-15 01:49:27,realDonaldTrump,,19623,27287,139560,"",,,,1239005760664801281,https://twitter.com/realDonaldTrump/status/1239005760664801281
2020-03-14 23:03:49,realDonaldTrump,Jentezen,12379,23633,85375,"Tomorrow I have called for a National Day of Prayer. I will be tuning in to Pastor @Jentezen at the @FreeChapel Church in Gainesville, Georgia at 11:00 AM EDT. God Bless the USA! http://freechapel.org/live",,@Jentezen @freechapel,,1238964078640578560,https://twitter.com/realDonaldTrump/status/1238964078640578560
2020-03-14 19:13:34,realDonaldTrump,,7779,16023,56587,"The @CDCgov has published guidelines on http://CoronaVirus.gov to enable every American to respond to this epidemic and to protect themselves, their families and their communities.",,@CDCgov,,1238906131302494215,https://twitter.com/realDonaldTrump/status/1238906131302494215
2020-03-14 19:06:09,realDonaldTrump,,5850,14852,92268,"Just had a nice conversation with Prime Minister @JustinTrudeau of Canada. Great to hear that his wonderful wife Sophie is doing very well. The United States and Canada will continue to coordinate closely together on COVID-19.",,@JustinTrudeau,,1238904264908582914,https://twitter.com/realDonaldTrump/status/1238904264908582914
2020-03-14 18:20:05,realDonaldTrump,,4697,11955,50351,"",,,,1238892672628281346,https://twitter.com/realDonaldTrump/status/1238892672628281346
2020-03-14 17:54:49,realDonaldTrump,,5514,13199,52325,"COVID-19 UPDATE",,,,1238886316013760519,https://twitter.com/realDonaldTrump/status/1238886316013760519
2020-03-14 17:31:56,realDonaldTrump,,33683,113855,631193,"THE UNITED STATES LOVES ITALY!",,,,1238880558052257794,https://twitter.com/realDonaldTrump/status/1238880558052257794
2020-03-14 16:14:08,realDonaldTrump,,8574,10974,50656,"Just finished a meeting on Covid-19 in the Situation Room, news conference coming up shortly. https://twitter.com/realDonaldTrump/status/1238823680735612930",,,,1238860976176467969,https://twitter.com/realDonaldTrump/status/1238860976176467969
2020-03-14 15:57:29,realDonaldTrump,,6728,11641,77625,"News Conference at White House in 10 minutes.",,,,1238856787824164865,https://twitter.com/realDonaldTrump/status/1238856787824164865
2020-03-14 13:47:24,realDonaldTrump,,31822,46546,226998,"SOCIAL DISTANCING!",,,,1238824050924883968,https://twitter.com/realDonaldTrump/status/1238824050924883968
2020-03-14 13:45:56,realDonaldTrump,,14012,15895,96344,"Attending meetings on Covid-19 in the White House. Working with States and local governments, many of whom have done a great job. Full report latter!",,,,1238823680735612930,https://twitter.com/realDonaldTrump/status/1238823680735612930
2020-03-14 12:08:12,realDonaldTrump,,40423,29298,180275,"BIGGEST STOCK MARKET RISE IN HISTORY YESTERDAY!",,,,1238799084263260161,https://twitter.com/realDonaldTrump/status/1238799084263260161
2020-03-14 12:02:56,realDonaldTrump,larryelder,2704,19252,91770,"Larry, I am not surprised that Candace was great. I would only be surprised if she wasn’t great!",,,,1238797759161008128,https://twitter.com/realDonaldTrump/status/1238797759161008128
2020-03-14 11:37:24,realDonaldTrump,,9330,21425,143524,"Good teamwork between Republicans & Democrats as the House passes the big CoronaVirus Relief Bill. People really pulled together. Nice to see!",,,,1238791333252399104,https://twitter.com/realDonaldTrump/status/1238791333252399104
2020-03-14 01:27:54,realDonaldTrump,,15657,22690,98886,"To those families and citizens who are worried and concerned for themselves and their loved ones, I want you to know that your Federal Government will unleash every authority, resource and tool at its disposal to safeguard the lives and health of our people.",,,,1238637949530537985,https://twitter.com/realDonaldTrump/status/1238637949530537985
2020-03-14 00:42:32,realDonaldTrump,,4878,11855,57883,"....the health and well-being of American families FIRST. Look forward to signing the final Bill, ASAP!",,,,1238626531510976512,https://twitter.com/realDonaldTrump/status/1238626531510976512
2020-03-14 00:42:32,realDonaldTrump,,1468,12042,56892,"....the Secretary of the Treasury and the Secretary of Labor to issue regulations that will provide flexibility so that in no way will Small Businesses be hurt. I encourage all Republicans and Democrats to come together and VOTE YES! I will always put....",,,,1238626530361847810,https://twitter.com/realDonaldTrump/status/1238626530361847810
2020-03-14 00:42:25,realDonaldTrump,,12878,24198,117274,"I fully support H.R. 6201: Families First CoronaVirus Response Act, which will be voted on in the House this evening. This Bill will follow my direction for free CoronaVirus tests, and paid sick leave for our impacted American workers. I have directed....",,,,1238626501555298308,https://twitter.com/realDonaldTrump/status/1238626501555298308
2020-03-13 23:10:37,realDonaldTrump,,10584,19318,77323,"Americans are the strongest and most resilient people on earth...We will remove or eliminate every obstacle necessary to deliver our people the care that they need, and that they are entitled to. No resource will be spared.",,,,1238603402457812992,https://twitter.com/realDonaldTrump/status/1238603402457812992
2020-03-13 22:54:37,realDonaldTrump,,10750,34600,141410,"....No matter where you may be, I encourage you to turn towards prayer in an act of faith. Together, we will easily PREVAIL!",,,,1238599373417787394,https://twitter.com/realDonaldTrump/status/1238599373417787394
2020-03-13 22:54:36,realDonaldTrump,,39872,92188,367230,"It is my great honor to declare Sunday, March 15th as a National Day of Prayer. We are a Country that, throughout our history, has looked to God for protection and strength in times like these....",,,,1238599369466753026,https://twitter.com/realDonaldTrump/status/1238599369466753026
2020-03-13 22:21:18,realDonaldTrump,,8858,23615,118341,"At my request, effective midnight tonight, Carnival, Royal Caribbean, Norwegian, and MSC have all agreed to suspend outbound cruises for thirty days. It is a great and important industry – it will be kept that way!",,,,1238590988593086464,https://twitter.com/realDonaldTrump/status/1238590988593086464
2020-03-13 21:19:39,realDonaldTrump,,11794,21968,101225,"We will remove or eliminate every obstacle necessary to deliver our people the care they need. No resource will be spared!",,,,1238575476916006915,https://twitter.com/realDonaldTrump/status/1238575476916006915
2020-03-13 21:00:16,realDonaldTrump,,9360,21992,94014,"To unleash the full power of the Federal Government in this effort, today I am officially declaring a National Emergency.",,,,1238570595710836738,https://twitter.com/realDonaldTrump/status/1238570595710836738
2020-03-13 14:55:34,realDonaldTrump,,35796,28530,147368,"I will be having a news conference today at 3:00 P.M., The White House. Topic: CoronaVirus!",,,,1238478818135945216,https://twitter.com/realDonaldTrump/status/1238478818135945216
2020-03-13 14:52:59,realDonaldTrump,,32504,29925,155510,"To this point, and because we have had a very strong border policy, we have had 40 deaths related to CoronaVirus. If we had weak or open borders, that number would be many times higher!",,,,1238478167695863817,https://twitter.com/realDonaldTrump/status/1238478167695863817
2020-03-13 13:44:29,realDonaldTrump,,14433,21033,86387,"The Federal Reserve must FINALLY lower the Fed Rate to something comparable to their competitor Central Banks. Jay Powell and group are putting us at a decided economic & physiological disadvantage. Should never have been this way. Also, STIMULATE!",,,,1238460927328075778,https://twitter.com/realDonaldTrump/status/1238460927328075778
2020-03-13 12:30:48,realDonaldTrump,,26709,41409,166158,"If you want to get money into the hands of people quickly & efficiently, let them have the full money that they earned, APPROVE A PAYROLL TAX CUT until the end of the year, December 31. Then you are doing something that is really meaningful. Only that will make a big difference!",,,,1238442385048305664,https://twitter.com/realDonaldTrump/status/1238442385048305664
2020-03-13 10:22:19,realDonaldTrump,,20780,19170,71830,".... Their response to H1N1 Swine Flu was a full scale disaster, with thousands dying, and nothing meaningful done to fix the testing problem, until now. The changes have been made and testing will soon happen on a very large scale basis. All Red Tape has been cut, ready to go!",,,,1238410051758575617,https://twitter.com/realDonaldTrump/status/1238410051758575617
2020-03-13 10:22:17,realDonaldTrump,,44425,23502,88323,"For decades the @CDCgov looked at, and studied, its testing system, but did nothing about it. It would always be inadequate and slow for a large scale pandemic, but a pandemic would never happen, they hoped. President Obama made changes that only complicated things further.....",,@CDCgov,,1238410044263333894,https://twitter.com/realDonaldTrump/status/1238410044263333894
2020-03-13 02:33:48,realDonaldTrump,,30121,29342,94851,"“The Obama White House had to immediately issue an apology for Joe Biden’s remarks, and any alarm that he might have caused, an alarm about a Swine Flu outbreak that took 6 months for President Obama to declare a National Emergency, and that killed 12,000 Americans.” @LouDobbs",,@LouDobbs,,1238292145242603522,https://twitter.com/realDonaldTrump/status/1238292145242603522
2020-03-13 02:20:56,realDonaldTrump,,57137,35299,140402,"Sleepy Joe Biden was in charge of the H1N1 Swine Flu epidemic which killed thousands of people. The response was one of the worst on record. Our response is one of the best, with fast action of border closings & a 78% Approval Rating, the highest on record. His was lowest!",,,,1238288908431036423,https://twitter.com/realDonaldTrump/status/1238288908431036423
2020-03-13 01:58:02,realDonaldTrump,,13337,21786,123251,"Just had a great conversation with Prime Minister Abe of Japan. I told him that the just completed Olympic venue is magnificent. He has done an incredible job, one that will make him very proud. Good things will happen for Japan and their great Prime Minister. Lots of options!",,,,1238283146350809088,https://twitter.com/realDonaldTrump/status/1238283146350809088
2020-03-12 20:02:21,realDonaldTrump,,31671,21988,136499,"108 countries are dealing with the CoronaVirus problem, some of which we are helping!",,,,1238193633825882113,https://twitter.com/realDonaldTrump/status/1238193633825882113
2020-03-12 18:02:02,realDonaldTrump,,3015,9060,31256,"KEEPING THE WORKPLACE SAFE, ENCOURAGE YOUR EMPLOYEES TO....",,,,1238163357049511937,https://twitter.com/realDonaldTrump/status/1238163357049511937
2020-03-12 18:02:00,realDonaldTrump,,1451,8735,30650,"KEEPING COMMERCIAL ESTABLISHMENTS SAFE, ENCOURAGE YOUR EMPLOYEES AND CUSTOMERS TO....",,,,1238163344902799364,https://twitter.com/realDonaldTrump/status/1238163344902799364
2020-03-12 18:01:57,realDonaldTrump,,617,4138,13234,"KEEPING THE SCHOOL SAFE, ENCOURAGE YOUR FACULTY, STAFF, AND STUDENTS TO....",,,,1238163334412881920,https://twitter.com/realDonaldTrump/status/1238163334412881920
2020-03-12 18:01:55,realDonaldTrump,,8626,21476,75605,"KEEPING THE HOME SAFE, ENCOURAGE YOUR FAMILY MEMBERS TO....",,,,1238163326372364289,https://twitter.com/realDonaldTrump/status/1238163326372364289
2020-03-12 14:44:36,realDonaldTrump,,41638,30142,133227,"Many Republican Senators want me to Veto the FISA Bill until we find out what led to, and happened with, the illegal attempted “coup” of the duly elected President of the United States, and others!",,,,1238113667754995712,https://twitter.com/realDonaldTrump/status/1238113667754995712
2020-03-12 10:15:43,realDonaldTrump,,31168,36762,139684,"“Nancy Pelosi all of a sudden doesn’t like the payroll tax cut, but when Obama proposed it she thought it was a brilliant thing that all of the working families would benefit from because if you get a paycheck, you’re going to take home more money.” @kilmeade @foxandfriends",,@kilmeade @foxandfriends,,1238046001744826369,https://twitter.com/realDonaldTrump/status/1238046001744826369
2020-03-12 02:13:32,realDonaldTrump,,22367,30969,135249,"Hoping to get the payroll tax cut approved by both Republicans and Democrats, and please remember, very important for all countries & businesses to know that trade will in no way be affected by the 30-day restriction on travel from Europe. The restriction stops people not goods.",,,,1237924658185469954,https://twitter.com/realDonaldTrump/status/1237924658185469954
2020-03-12 02:11:12,realDonaldTrump,,14600,38191,156157,"",,,,1237924069397467137,https://twitter.com/realDonaldTrump/status/1237924069397467137
2020-03-11 22:04:26,realDonaldTrump,,44996,48427,249838,"The Media should view this as a time of unity and strength. We have a common enemy, actually, an enemy of the World, the CoronaVirus. We must beat it as quickly and safely as possible. There is nothing more important to me than the life & safety of the United States!",,,,1237861968721010689,https://twitter.com/realDonaldTrump/status/1237861968721010689
2020-03-11 20:44:36,realDonaldTrump,,22228,26340,126250,"I will be addressing the Nation this evening at 9:00 P.M. (Eastern) from the Oval Office.",,,,1237841878889840642,https://twitter.com/realDonaldTrump/status/1237841878889840642
2020-03-11 19:18:35,realDonaldTrump,,30257,27719,153428,"I am fully prepared to use the full power of the Federal Government to deal with our current challenge of the CoronaVirus!",,,,1237820230296010752,https://twitter.com/realDonaldTrump/status/1237820230296010752
2020-03-11 19:17:50,realDonaldTrump,,5859,9608,41060,"....We have the greatest healthcare system, experts, scientists and doctors anywhere in the world. Together, we will PREVAIL!",,,,1237820044198977536,https://twitter.com/realDonaldTrump/status/1237820044198977536
2020-03-11 19:17:50,realDonaldTrump,,3505,13494,53918,"I want to thank all of our Great Government officials on the CoronaVirus Task Force who are working around the clock, in response to the CoronaVirus. Continue to check http://CDC.gov for updates, and follow all recommendations that are available....",,,,1237820042735226887,https://twitter.com/realDonaldTrump/status/1237820042735226887
2020-03-11 18:52:45,realDonaldTrump,,7436,12127,56686,"....Together we are putting into policy a plan to prevent, detect, treat and create a vaccine against CoronaVirus to save lives in America and the world. America will get it done!",,,,1237813728558678026,https://twitter.com/realDonaldTrump/status/1237813728558678026
