date,username,to,replies,retweets,favorites,text,geo,mentions,hashtags,id,permalink
2020-05-01 15:27:29,realDonaldTrump,,33945,45074,162081,"Concast (@NBCNews) and Fake News @CNN are going out of their way to say GREAT things about China. They are Chinese puppets who want to do business there. They use USA airwaves to help China. The Enemy of the People!",,@NBCNews @CNN,,1256243856166850560,https://twitter.com/realDonaldTrump/status/1256243856166850560
2020-05-01 12:42:23,realDonaldTrump,,62261,40311,208091,"The Governor of Michigan should give a little, and put out the fire. These are very good people, but they are angry. They want their lives back again, safely! See them, talk to them, make a deal.",,,,1256202305680158720,https://twitter.com/realDonaldTrump/status/1256202305680158720
2020-05-01 12:14:36,realDonaldTrump,,9117,20744,89352,"Cryin Chuck Schumer, compared to what other Senators have brought home to their states, has brought very little back to N.Y. A totally overrated loser, the one thing he has given them is SALT. He never even called me to stop it. No wonder Cuomo & most others can’t stand him. AOC!",,,,1256195312965877760,https://twitter.com/realDonaldTrump/status/1256195312965877760
2020-05-01 12:07:51,realDonaldTrump,,17219,24991,108630,"Cryin’ Chuck Schumer was on a late night show using a false talking point over & over again. “We don’t have enough testing ,” he would repeat, when he knows we have done a great job on Testing, just like we have on Ventilators and everything else. He lied, gave NY SALT. Run AOC!",,,,1256193615724007425,https://twitter.com/realDonaldTrump/status/1256193615724007425
2020-05-01 11:55:42,realDonaldTrump,TomFitton,8040,19389,81564,"Dirty Cop!",,,,1256190556839051264,https://twitter.com/realDonaldTrump/status/1256190556839051264
2020-05-01 11:54:13,realDonaldTrump,WhiteHouse,9303,15245,67855,"I have done more for farmers and ranchers than any President in history, and it has been my honor in doing so!",,,,1256190183298473985,https://twitter.com/realDonaldTrump/status/1256190183298473985
2020-05-01 00:54:46,realDonaldTrump,,16386,37858,155273,"“The only thing we got wrong is that it was even worse (the corruption) than we thought.” @Jim_Jordan DIRTY COPS!",,@Jim_Jordan,,1256024228777857025,https://twitter.com/realDonaldTrump/status/1256024228777857025
2020-05-01 00:23:04,realDonaldTrump,,3767,11133,34683,"Vote @MikeGarcia2020 by May 12th! His opponent @ChristyforCA25 voted to fire teachers, and cut their salaries while bumping up her pay. Now she’s mocking our Great Vets! We need Navy Fighter Pilot Mike Garcia in #CA25!",,@MikeGarcia2020 @ChristyforCA25,#CA25,1256016249169084417,https://twitter.com/realDonaldTrump/status/1256016249169084417
2020-05-01 00:11:06,realDonaldTrump,,2216,8405,33036,"....He is Strong on Crime, the Border, and Second Amendment. Tom has deep roots in Wisconsin, is a big Tax Cutter, and will help me DRAIN THE SWAMP! Tom has my Complete and Total Endorsement. Vote for Tom Tiffany!",,,,1256013240896835585,https://twitter.com/realDonaldTrump/status/1256013240896835585
2020-05-01 00:11:06,realDonaldTrump,,3475,13430,55547,"Tom Tiffany (@TomTiffanyWI) is a Great Advocate for the incredible people of Wisconsin (WI07). We need Tom in Congress to help us Make America Great Again! He will Fight for Small Business, supports our Incredible Farmers, Loves our Military and our Vets....",,@TomTiffanyWI,,1256013239487549441,https://twitter.com/realDonaldTrump/status/1256013239487549441
2020-04-30 18:25:29,realDonaldTrump,,12881,16663,64278,"Over 120 MILLION Economic Impact Payments have already gone out to hardworking Americans! If you haven’t yet received your payment, go to http://IRS.gov and click on “GET MY PAYMENT” to receive your money FAST!",,,,1255926261068763143,https://twitter.com/realDonaldTrump/status/1255926261068763143
2020-04-30 14:09:10,realDonaldTrump,,45157,44559,204430,"We can’t let the Fake News, and their partner, the Radical Left, Do Nothing Democrats, get away with stealing the Election. They tried that in 2016. How did that work out?",,,,1255861756741726208,https://twitter.com/realDonaldTrump/status/1255861756741726208
2020-04-30 12:53:30,realDonaldTrump,GOPLeader,7290,12298,43416,"The Do Nothing Democrats!",,,,1255842713603387392,https://twitter.com/realDonaldTrump/status/1255842713603387392
2020-04-30 12:31:39,realDonaldTrump,realDonaldTrump,4060,11705,44102,"FAKE NEWS!",,,,1255837215927787520,https://twitter.com/realDonaldTrump/status/1255837215927787520
2020-04-30 12:30:54,realDonaldTrump,GenFlynn,2366,13381,58378,"Great!",,,,1255837028526297088,https://twitter.com/realDonaldTrump/status/1255837028526297088
2020-04-30 12:11:23,realDonaldTrump,,22293,54188,241793,"DIRTY COP JAMES COMEY GOT CAUGHT!",,,,1255832117583495169,https://twitter.com/realDonaldTrump/status/1255832117583495169
2020-04-30 12:02:43,realDonaldTrump,TomFitton,2696,13626,48403,"Plus many!",,,,1255829937690480643,https://twitter.com/realDonaldTrump/status/1255829937690480643
2020-04-30 11:59:20,realDonaldTrump,mitchellvii,6082,8010,39101,"Really? Have you looked at the numbers lately!",,,,1255829082660577283,https://twitter.com/realDonaldTrump/status/1255829082660577283
2020-04-30 11:56:44,realDonaldTrump,,11928,19476,116016,"FAKE POLLING, just like 2016 (but worse)!",,,,1255828428814770176,https://twitter.com/realDonaldTrump/status/1255828428814770176
2020-04-30 11:47:47,realDonaldTrump,,16083,38493,163442,"What happened to General Michael Flynn, a war hero, should never be allowed to happen to a citizen of the United States again!",,,,1255826177350144001,https://twitter.com/realDonaldTrump/status/1255826177350144001
2020-04-30 11:47:04,realDonaldTrump,,16535,29049,100527,"Does anybody really believe that Roger Stone, a man whose house was raided early in the morning by 29 gun toting FBI Agents (with Fake News @CNN closely in toe), was treated fairly. How about the jury forewoman with her unannounced hatred &amp; bias. Same scammers as General Flynn!",,@CNN,,1255825998521741312,https://twitter.com/realDonaldTrump/status/1255825998521741312
2020-04-30 11:45:41,realDonaldTrump,,21345,17538,85304,"Despite reports to the contrary, Sweden is paying heavily for its decision not to lockdown. As of today, 2462 people have died there, a much higher number than the neighboring countries of Norway (207), Finland (206) or Denmark (443). The United States made the correct decision!",,,,1255825648448348161,https://twitter.com/realDonaldTrump/status/1255825648448348161
2020-04-30 04:41:15,realDonaldTrump,,9210,19905,60750,"Lyin’ Brian Williams of MSDNC!",,,,1255718837762306049,https://twitter.com/realDonaldTrump/status/1255718837762306049
2020-04-30 04:23:59,realDonaldTrump,,44570,35559,148653,"I must admit that Lyin’ Brian Williams is, while dumber than hell, quite a bit smarter than Fake News @CNN “anchorman” Don Lemon, the “dumbest man on television”. Then you have Psycho Joe “What Ever Happened To Your Girlfriend?” Scarborough, another of the low I.Q. individuals!",,@CNN,,1255714490554953736,https://twitter.com/realDonaldTrump/status/1255714490554953736
2020-04-30 04:09:52,realDonaldTrump,,15350,24659,109479,"Lyin’ Brian Williams of MSDNC, a Concast Scam Company, wouldn’t know the truth if it was nailed to his wooden forehead. Remember when he lied about his bravery in a helicopter? Totally made up story. He’s a true dummy who was thrown off Network News like a dog. Stay tuned!",,,,1255710938075889664,https://twitter.com/realDonaldTrump/status/1255710938075889664
2020-04-30 04:01:08,realDonaldTrump,,13529,26699,118605,"Just told that Fake News @CNN is falsely reporting that I was recently shouting at my campaign manager over made up nonsense. Actually, he is doing a great job, I never shouted at him (been with me for years, including the 2016 win), &amp; have no intention to do so. Just FAKE NEWS!",,@CNN,,1255708741950943233,https://twitter.com/realDonaldTrump/status/1255708741950943233
2020-04-30 03:52:46,realDonaldTrump,,16575,42855,146639,".@CNN doesn’t want to speak about their persecution of General Michael Flynn &amp; why they got the story so wrong. They, along with others, should pay a big price for what they have purposely done to this man &amp; his family. They won’t even cover the big breaking news about this scam!",,@CNN,,1255706636972363776,https://twitter.com/realDonaldTrump/status/1255706636972363776
2020-04-30 03:11:27,realDonaldTrump,,3912,15863,53322,"",,,,1255696235970940934,https://twitter.com/realDonaldTrump/status/1255696235970940934
2020-04-30 00:52:36,realDonaldTrump,,1920,7637,48237,"Happy Birthday to three time Olympian and five term Congressman, @JimRyun!",,@jimryun,,1255661296047067138,https://twitter.com/realDonaldTrump/status/1255661296047067138
2020-04-30 00:36:26,realDonaldTrump,,8049,27121,81691,"",,,,1255657225659523072,https://twitter.com/realDonaldTrump/status/1255657225659523072
2020-04-30 00:34:07,realDonaldTrump,,6925,28938,81318,"",,,,1255656645759246341,https://twitter.com/realDonaldTrump/status/1255656645759246341
2020-04-29 14:55:22,realDonaldTrump,TheRickWilson,9493,14756,61086,"No, I think Amash would make a wonderful candidate, especially since he is way behind in his district and has no chance of maintaining his Congressional seat. He almost always votes for the Do Nothing Dems anyway. I like him even more than Jill Stein!",,,,1255510996623527936,https://twitter.com/realDonaldTrump/status/1255510996623527936
2020-04-29 14:42:56,realDonaldTrump,,7116,22123,69191,"THANK YOU @MarkLevinShow!",,@marklevinshow,,1255507868280856581,https://twitter.com/realDonaldTrump/status/1255507868280856581
2020-04-29 13:09:39,realDonaldTrump,maxwelltani,9136,22554,72891,"At least they admit it. The Failing @nytimes &amp; @washingtonpost never correct their Fake Reporting!",,@nytimes @washingtonpost,,1255484391364665351,https://twitter.com/realDonaldTrump/status/1255484391364665351
2020-04-29 04:23:38,realDonaldTrump,,63876,42628,259098,"The only reason the U.S. has reported one million cases of CoronaVirus is that our Testing is sooo much better than any other country in the World. Other countries are way behind us in Testing, and therefore show far fewer cases!",,,,1255352014042738688,https://twitter.com/realDonaldTrump/status/1255352014042738688
2020-04-29 02:39:07,realDonaldTrump,,4193,17205,78010,"THANK YOU MICHAEL! @bittyandbeaus",,@bittyandbeaus,,1255325711960768514,https://twitter.com/realDonaldTrump/status/1255325711960768514
2020-04-28 20:24:20,realDonaldTrump,,8583,20914,88485," https://twitter.com/realDonaldTrump/status/1255145720136359945",,,,1255231394923646976,https://twitter.com/realDonaldTrump/status/1255231394923646976
2020-04-28 20:14:31,realDonaldTrump,,7595,13417,61751,"",,,,1255228926428942339,https://twitter.com/realDonaldTrump/status/1255228926428942339
2020-04-28 14:43:53,realDonaldTrump,,8517,12628,49707,"Thank you @BlueAngels and @AFThunderbirds! #AmericaStrong https://twitter.com/BlueAngels/status/1255144203849326594",,@BlueAngels @AFThunderbirds,#AmericaStrong,1255145720136359945,https://twitter.com/realDonaldTrump/status/1255145720136359945
2020-04-28 13:57:14,realDonaldTrump,DiamondandSilk,12734,25078,111774,"But I love Diamond & Silk, and so do millions of people!",,,,1255133977360265218,https://twitter.com/realDonaldTrump/status/1255133977360265218
2020-04-28 13:42:38,realDonaldTrump,,9429,25792,146143,"Texas to open businesses in phases beginning Friday. Great job being done by @GregAbbott_TX",,@GregAbbott_TX,,1255130302655148033,https://twitter.com/realDonaldTrump/status/1255130302655148033
2020-04-28 13:38:54,realDonaldTrump,,20884,32406,212093,"Many States moving to SAFELY & QUICKLY reopen!",,,,1255129366234890240,https://twitter.com/realDonaldTrump/status/1255129366234890240
2020-04-28 12:06:03,realDonaldTrump,,57016,38333,218396,"We are doing far more, and better, Testing than any other country in the world, and yet the media does nothing but complain. No matter how good a job is done, the same as with the Ventilators, they will never say we are doing a great job, they will only viciously gripe!",,,,1255105998471249923,https://twitter.com/realDonaldTrump/status/1255105998471249923
2020-04-28 02:54:29,realDonaldTrump,Jim_Jordan,14726,29342,112797,"Because Shifty is a crooked politician!",,,,1254967193420402696,https://twitter.com/realDonaldTrump/status/1254967193420402696
2020-04-27 22:59:34,realDonaldTrump,,14612,17740,80325,"",,,,1254908072067313670,https://twitter.com/realDonaldTrump/status/1254908072067313670
2020-04-27 20:58:59,realDonaldTrump,,21674,15839,125858,"I will be having a White House Press Conference today at 5:30 P.M. Thank you!",,,,1254877727804600321,https://twitter.com/realDonaldTrump/status/1254877727804600321
2020-04-27 14:41:11,realDonaldTrump,,77416,46390,216392,"Why should the people and taxpayers of America be bailing out poorly run states (like Illinois, as example) and cities, in all cases Democrat run and managed, when most of the other states are not looking for bailout help? I am open to discussing anything, but just asking?",,,,1254782650679615492,https://twitter.com/realDonaldTrump/status/1254782650679615492
2020-04-27 13:48:07,realDonaldTrump,,72860,79880,397241,"FAKE NEWS, THE ENEMY OF THE PEOPLE!",,,,1254769296280031232,https://twitter.com/realDonaldTrump/status/1254769296280031232
2020-04-27 13:41:01,realDonaldTrump,,42721,46838,214176,"There has never been, in the history of our Country, a more vicious or hostile Lamestream Media than there is right now, even in the midst of a National Emergency, the Invisible Enemy!",,,,1254767509460234243,https://twitter.com/realDonaldTrump/status/1254767509460234243
2020-04-27 12:20:41,realDonaldTrump,,35710,43098,174985,"Blame the Democrats for any “lateness” in your Enhanced Unemployment Insurance. I wanted the money to be paid directly, they insisted it be paid by states for distribution. I told them this would happen, especially with many states which have old computers.",,,,1254747293414305792,https://twitter.com/realDonaldTrump/status/1254747293414305792
2020-04-27 01:42:10,realDonaldTrump,realDonaldTrump,26547,26686,133966,"So true!",,,,1254586604360011776,https://twitter.com/realDonaldTrump/status/1254586604360011776
2020-04-27 01:06:17,realDonaldTrump,DonaldJTrumpJr,5729,15929,61013,"American citizens! We were long ahead of Dems, who were all against the BAN.",,,,1254577575449497602,https://twitter.com/realDonaldTrump/status/1254577575449497602
2020-04-27 00:59:33,realDonaldTrump,KayaJones,2680,11816,53913,"Great!",,,,1254575880510287872,https://twitter.com/realDonaldTrump/status/1254575880510287872
2020-04-27 00:22:26,realDonaldTrump,PressSec,6711,14091,56076,"They are one of the worst in the “news” business. Total slime balls!",,,,1254566538725797888,https://twitter.com/realDonaldTrump/status/1254566538725797888
2020-04-27 00:19:55,realDonaldTrump,DavidJUrban,7052,13299,57023,"They asked me to be at West Point on June 13th., & I will be there!",,,,1254565907399139328,https://twitter.com/realDonaldTrump/status/1254565907399139328
2020-04-27 00:14:39,realDonaldTrump,IngrahamAngle,3281,9885,43612,"Laura, just another Fake News Report!",,,,1254564582020059136,https://twitter.com/realDonaldTrump/status/1254564582020059136
2020-04-26 22:54:17,realDonaldTrump,,68034,32109,174619,"Does anybody get the meaning of what a so-called Noble (not Nobel) Prize is, especially as it pertains to Reporters and Journalists? Noble is defined as, “having or showing fine personal qualities or high moral principles and ideals.” Does sarcasm ever work?",,,,1254544354603143168,https://twitter.com/realDonaldTrump/status/1254544354603143168
2020-04-26 21:53:32,realDonaldTrump,,12098,22867,90968,"Reports that H.H.S. Secretary @AlexAzar is going to be “fired” by me are Fake News. The Lamestream Media knows this, but they are desperate to create the perception of chaos &amp; havoc in the minds of the public. They never even called to ask. Alex is doing an excellent job!",,@AlexAzar,,1254529069733105665,https://twitter.com/realDonaldTrump/status/1254529069733105665
2020-04-26 21:21:03,realDonaldTrump,,12924,17257,69183,"....fraud @donnabrazile (and others who are even worse). Chris Wallace is nastier to Republicans than even Deface the Nation or Sleepy Eyes. The people who are watching @FoxNews, in record numbers (thank you President Trump), are angry. They want an alternative now. So do I!",,@donnabrazile @FoxNews,,1254520891863678977,https://twitter.com/realDonaldTrump/status/1254520891863678977
2020-04-26 21:21:02,realDonaldTrump,,3623,13528,55400,"....Even the Radical Left Do Nothing Democrats laughed at the Fox suggestion. No respect for the people running @FoxNews. But Fox keeps on plugging to try and become politically correct. They put RINO Paul Ryan on their Board. They hire “debate questions to Crooked Hillary”....",,@FoxNews,,1254520890991218691,https://twitter.com/realDonaldTrump/status/1254520890991218691
2020-04-26 21:21:02,realDonaldTrump,,16210,23738,96166,".@FoxNews just doesn’t get what’s happening! They are being fed Democrat talking points, and they play them without hesitation or research. They forgot that Fake News @CNN &amp; MSDNC wouldn’t let @FoxNews participate, even a little bit, in the poor ratings Democrat Debates.....",,@FoxNews @CNN @FoxNews,,1254520889212837890,https://twitter.com/realDonaldTrump/status/1254520889212837890
2020-04-26 18:28:35,realDonaldTrump,,18865,19141,96818,"....schedule and eating habits, written by a third rate reporter who knows nothing about me. I will often be in the Oval Office late into the night & read & see that I am angrily eating a hamburger & Diet Coke in my bedroom. People with me are always stunned. Anything to demean!",,,,1254477491642732552,https://twitter.com/realDonaldTrump/status/1254477491642732552
2020-04-26 18:28:35,realDonaldTrump,,33267,29770,149838,"I work from early in the morning until late at night, haven’t left the White House in many months (except to launch Hospital Ship Comfort) in order to take care of Trade Deals, Military Rebuilding etc., and then I read a phony story in the failing @nytimes about my work....",,@nytimes,,1254477490678104064,https://twitter.com/realDonaldTrump/status/1254477490678104064
2020-04-26 18:21:24,realDonaldTrump,,84899,51046,286013,"The people that know me and know the history of our Country say that I am the hardest working President in history. I don’t know about that, but I am a hard worker and have probably gotten more done in the first 3 1/2 years than any President in history. The Fake News hates it!",,,,1254475682723307520,https://twitter.com/realDonaldTrump/status/1254475682723307520
2020-04-26 17:42:04,realDonaldTrump,,3669,9453,53929,".@CardinalDolan Thank you for a great call yesterday with Catholic Leaders, and a great Service today from @StPatsNYC!",,@CardinalDolan @StPatsNYC,,1254465783821934595,https://twitter.com/realDonaldTrump/status/1254465783821934595
2020-04-26 16:06:42,realDonaldTrump,,51156,64192,574970,"Happy Birthday to Melania, our great First Lady!",,,,1254441783523762182,https://twitter.com/realDonaldTrump/status/1254441783523762182
2020-04-26 01:06:20,realDonaldTrump,,14017,17069,81489,"Had a great call with Catholic Leaders and Educators earlier today. I will be online tomorrow at 10:15 A.M. (Eastern) for Sunday Mass celebrated by @CardinalDolan at St. Patrick’s Cathedral (@StPatsNYC) in New York City. Join me: https://saintpatrickscathedral.org/live",,@CardinalDolan @StPatsNYC,,1254215201911644163,https://twitter.com/realDonaldTrump/status/1254215201911644163
2020-04-25 22:23:30,realDonaldTrump,,93878,57372,277561,"I never said the pandemic was a Hoax! Who would say such a thing? I said that the Do Nothing Democrats, together with their Mainstream Media partners, are the Hoax. They have been called out & embarrassed on this, even admitting they were wrong, but continue to spread the lie!",,,,1254174221481246721,https://twitter.com/realDonaldTrump/status/1254174221481246721
2020-04-25 22:17:13,realDonaldTrump,,53228,59255,330493,"Remember, the Cure can’t be worse than the problem itself. Be careful, be safe, use common sense!",,,,1254172638307586049,https://twitter.com/realDonaldTrump/status/1254172638307586049
2020-04-25 22:01:41,realDonaldTrump,,97119,52675,240851,"What is the purpose of having White House News Conferences when the Lamestream Media asks nothing but hostile questions, & then refuses to report the truth or facts accurately. They get record ratings, & the American people get nothing but Fake News. Not worth the time & effort!",,,,1254168730898173953,https://twitter.com/realDonaldTrump/status/1254168730898173953
2020-04-25 20:30:42,realDonaldTrump,,71369,41461,190616,"Was just informed that the Fake News from the Thursday White House Press Conference had me speaking & asking questions of Dr. Deborah Birx. Wrong, I was speaking to our Laboratory expert, not Deborah, about sunlight etc. & the CoronaVirus. The Lamestream Media is corrupt & sick!",,,,1254145835450933249,https://twitter.com/realDonaldTrump/status/1254145835450933249
2020-04-25 15:59:22,realDonaldTrump,,17509,22931,110424,"If the Wall Street Journal “Editorial” writers had called, as they should have, they would have easily found that I was “NOT happy with the Georgia Governor on Tuesday night.” You said the opposite, and got it wrong as you often do!",,,,1254077550541844480,https://twitter.com/realDonaldTrump/status/1254077550541844480
2020-04-25 15:06:08,realDonaldTrump,,37803,33681,141512,"The Do Nothing Democrats are spending much of their money on Fake Ads. I never said that the CoronaVirus is a “Hoax”, I said that the Democrats, and the way they lied about it, are a Hoax. Also, it did start with “one person from China”, and then grew, & will be a “Miracle” end!",,,,1254064154954076163,https://twitter.com/realDonaldTrump/status/1254064154954076163
2020-04-25 14:57:29,realDonaldTrump,,34408,28251,164541,"We have now Tested more than 5 Million People. That is more than any other country in the World, and even more than all major countries combined!",,,,1254061979607711745,https://twitter.com/realDonaldTrump/status/1254061979607711745
2020-04-25 14:51:54,realDonaldTrump,,15930,22974,124190,"It is a wonderful feeling to know that our States are loaded up with Ventilators, many brand new and high quality just off of our production lines, and that we are now in a position to help other countries that so desperately need them. Every person needing a Ventilator got one!",,,,1254060573655998466,https://twitter.com/realDonaldTrump/status/1254060573655998466
2020-04-25 14:10:21,realDonaldTrump,,15087,26964,181103,"Just spoke to Prime Minister Abiy Ahmed Ali of Ethiopia. His Country needs Ventilators, and the U.S. is in good position to help him. We will!",,,,1254050117767880706,https://twitter.com/realDonaldTrump/status/1254050117767880706
2020-04-25 12:59:20,realDonaldTrump,CDCgov,8308,11141,41491,"Many testing sites are, and have been, open & available. Just passed 5 Million Tests, far more than any other country in the world. In fact, more than all other major countries combined! Don’t believe the Fake News!",,,,1254032243770736642,https://twitter.com/realDonaldTrump/status/1254032243770736642
2020-04-25 12:45:55,realDonaldTrump,,13314,17658,110796,"Thank you to the people of Colorado for the warm and gracious notes and letters sent to me for all of the Ventilators we got for you. It was my great honor! @SenCoryGardner",,@SenCoryGardner,,1254028869859971072,https://twitter.com/realDonaldTrump/status/1254028869859971072
2020-04-25 12:20:16,realDonaldTrump,VinceMcMahon,7905,20170,103381,".@TripleH is a total winner!",,@TripleH,,1254022414058631170,https://twitter.com/realDonaldTrump/status/1254022414058631170
2020-04-25 12:14:56,realDonaldTrump,,3555,11031,56864,"Thank you to William Perry Pendley of the Bureau of Land Management. Great job on @TuckerCarlson describing some of the most beautiful land in the world! @FoxNews",,@TuckerCarlson @FoxNews,,1254021070379769856,https://twitter.com/realDonaldTrump/status/1254021070379769856
2020-04-24 20:51:16,realDonaldTrump,,30740,13464,105983,"I will be having a White House Press Conference today at 5:30 P.M. Thank you!",,,,1253788620642750464,https://twitter.com/realDonaldTrump/status/1253788620642750464
2020-04-24 20:13:18,realDonaldTrump,,5682,9033,46762,"",,,,1253779068560039939,https://twitter.com/realDonaldTrump/status/1253779068560039939
2020-04-24 19:08:09,realDonaldTrump,,24045,30813,177539,"I will never let our Post Office fail. It has been mismanaged for years, especially since the advent of the internet and modern-day technology. The people that work there are great, and we’re going to keep them happy, healthy, and well!",,,,1253762674137149446,https://twitter.com/realDonaldTrump/status/1253762674137149446
2020-04-24 14:59:34,realDonaldTrump,,11297,16711,81084,"Great conversation with President Lenin Moreno of the Republic of Ecuador. We will be sending them desperately needed Ventilators, of which we have recently manufactured many, and helping them in other ways. They are fighting hard against CoronaVirus!",,,,1253700113383534598,https://twitter.com/realDonaldTrump/status/1253700113383534598
2020-04-24 14:59:05,realDonaldTrump,,5321,14153,74582,"Just spoke to President Juan Orlando Hernandez of the Republic of Honduras. We work closely together on the Southern Border. Will be helping him with his request for Ventilators and Testing.",,,,1253699994516946945,https://twitter.com/realDonaldTrump/status/1253699994516946945
